{
  "metadata": {
    "generated_at": "2026-08-13T08:30:00+00:00",
    "auditor_version": "0.3.0",
    "repository": "example/project",
    "commit": "example",
    "snapshot_kind": "synthetic-example"
  },
  "project": {
    "name": "Example Project",
    "mission": "Demonstrate the Project Intelligence Auditor data contract and command center.",
    "target_users": ["developers", "technical leads"],
    "current_stage": "prototype",
    "trl": 4,
    "scope_status": "reviewed"
  },
  "scores": {
    "confirmed_completion": 57.8,
    "estimated_completion": 68.0,
    "project_health": 72.0,
    "prototype_readiness": 82.0,
    "mvp_readiness": 78.57,
    "commercial_readiness": 38.0,
    "production_readiness": 28.57,
    "scale_readiness": 29.0,
    "research_readiness": null,
    "confidence": 84.0
  },
  "modules": [
    {
      "id": "core",
      "name": "Core workflow",
      "path": "src/core",
      "role_hint": "backend",
      "responsibility": "Execute the primary user workflow.",
      "classification": "critical_path",
      "implementation": 80,
      "integration": 75,
      "validation": 65,
      "documentation": 55,
      "operational_readiness": 45,
      "completion": 68.0,
      "confirmed_completion": 57.8,
      "quality": 72,
      "confidence": 84,
      "criticality": 1.0,
      "evidence_level": "E3",
      "dependencies": ["storage"],
      "consumers": [],
      "evidence_ids": ["ev-core-test", "ev-core-storage-import"],
      "status": "reviewed"
    },
    {
      "id": "storage",
      "name": "Storage",
      "path": "src/storage",
      "role_hint": "database",
      "responsibility": "Persist project state.",
      "classification": "important",
      "implementation": 75,
      "integration": 70,
      "validation": 50,
      "documentation": 60,
      "operational_readiness": 40,
      "completion": 63.75,
      "confirmed_completion": 28.69,
      "quality": 68,
      "confidence": 70,
      "criticality": 0.75,
      "evidence_level": "E2",
      "dependencies": [],
      "consumers": ["core"],
      "evidence_ids": ["ev-storage-code"],
      "status": "reviewed"
    }
  ],
  "dependency_edges": [
    {
      "from": "core",
      "to": "storage",
      "kind": "static_import",
      "confidence": 0.94,
      "occurrences": 3,
      "evidence_ids": ["ev-core-storage-import"]
    }
  ],
  "architecture_analysis": {
    "cycles": [],
    "hotspots": [
      {"module_id": "storage", "fan_in": 1, "fan_out": 0, "centrality": 1.0}
    ],
    "limitations": ["Synthetic static dependency example."],
    "status": "reviewed"
  },
  "evidence": [
    {
      "id": "ev-core-test",
      "level": "E3",
      "claim": "The core workflow is exercised by a reproducible integration test.",
      "kind": "test_result",
      "source": "tests/test_core.py",
      "location": "test_core_workflow",
      "confidence": 0.9,
      "verified_at": "2026-08-13T08:00:00+00:00"
    },
    {
      "id": "ev-storage-code",
      "level": "E2",
      "claim": "Storage implementation exists but persistence recovery behavior has not been validated.",
      "kind": "implementation",
      "source": "src/storage",
      "location": null,
      "confidence": 0.8,
      "verified_at": null
    },
    {
      "id": "ev-core-storage-import",
      "level": "E2",
      "claim": "Static imports show that the core workflow depends on storage.",
      "kind": "static_import_dependency",
      "source": "src/core/service.py",
      "location": "line 4",
      "confidence": 0.94,
      "verified_at": null
    }
  ],
  "validation_runs": [
    {
      "id": "validation-tests",
      "action": "Run project tests",
      "command": "pytest",
      "status": "tested_pass",
      "summary": "Core happy-path tests pass.",
      "evidence_ids": ["ev-core-test"]
    }
  ],
  "risks": [
    {
      "id": "risk-runtime",
      "title": "Runtime failure handling is incomplete",
      "probability": 3,
      "impact": 4,
      "score": 12,
      "category": "operational",
      "mitigation": "Add integration failure tests and explicit recovery paths.",
      "evidence_ids": ["ev-core-test"]
    }
  ],
  "technical_debt": [
    {"id": "debt-recovery-tests", "title": "Recovery paths lack regression coverage", "severity": "high"}
  ],
  "bottlenecks": [
    {
      "id": "bottleneck-failure-recovery",
      "title": "Failure recovery is under-validated",
      "why": "The happy path is demonstrated, but failure recovery lacks strong evidence.",
      "severity": "high",
      "evidence_ids": ["ev-core-test"]
    }
  ],
  "directions": [
    {
      "name": "Developer tool",
      "description": "Package the current workflow as a reusable developer-facing tool.",
      "direction_score": 76,
      "time_to_mvp": "short",
      "time_to_revenue": "medium"
    },
    {
      "name": "Enterprise platform",
      "description": "Extend the workflow with governance, multi-user controls, and deployment tooling.",
      "direction_score": 58,
      "time_to_mvp": "medium",
      "time_to_revenue": "long"
    }
  ],
  "commercialization": {
    "target_customer": "Technical teams with a repeated workflow matching the core capability",
    "value_proposition": "Reduce repeated manual analysis and make project state evidence-driven.",
    "technical_moat": "Workflow integration and audit history rather than a single algorithm.",
    "data_moat": null,
    "workflow_moat": "Historical evidence and project-specific audit workflow integration.",
    "time_to_revenue": "unknown",
    "primary_blocker": "No verified customer discovery in this synthetic example."
  },
  "readiness_gates": {
    "mvp": {
      "score_key": "mvp_readiness",
      "threshold": 75,
      "minimum_coverage": 0.65,
      "criteria": [
        {
          "id": "core-workflow",
          "title": "Core workflow is end-to-end",
          "status": "pass",
          "weight": 4,
          "confidence": 0.95,
          "critical": true,
          "evidence_ids": ["ev-core-test"]
        },
        {
          "id": "failure-handling",
          "title": "Critical failure paths are handled",
          "status": "partial",
          "weight": 3,
          "confidence": 0.8,
          "critical": true,
          "evidence_ids": ["ev-core-test"]
        },
        {
          "id": "reproducible-setup",
          "title": "Setup is reproducible for an evaluator",
          "status": "unknown",
          "weight": 2,
          "confidence": 0,
          "critical": false,
          "evidence_ids": []
        }
      ],
      "evaluation": {
        "score": 78.57,
        "assessed_score": 78.57,
        "lower_bound": 61.11,
        "upper_bound": 83.33,
        "coverage": 77.78,
        "confidence": 68.89,
        "threshold": 75,
        "minimum_coverage": 65,
        "state": "ready",
        "blocked": false,
        "critical_failures": [],
        "critical_unknowns": [],
        "status_counts": {"pass": 1, "partial": 1, "fail": 0, "unknown": 1, "not_applicable": 0}
      }
    },
    "production": {
      "score_key": "production_readiness",
      "threshold": 80,
      "minimum_coverage": 0.7,
      "criteria": [
        {"id": "validated-core", "status": "partial", "weight": 4, "confidence": 0.85, "critical": true, "evidence_ids": ["ev-core-test"]},
        {"id": "recovery", "status": "fail", "weight": 3, "confidence": 0.9, "critical": true, "evidence_ids": ["ev-core-test"]},
        {"id": "observability", "status": "unknown", "weight": 2, "confidence": 0, "critical": false, "evidence_ids": []}
      ],
      "evaluation": {
        "score": 28.57,
        "assessed_score": 28.57,
        "lower_bound": 22.22,
        "upper_bound": 44.44,
        "coverage": 77.78,
        "confidence": 67.78,
        "threshold": 80,
        "minimum_coverage": 70,
        "state": "blocked",
        "blocked": true,
        "critical_failures": ["recovery"],
        "critical_unknowns": [],
        "status_counts": {"pass": 0, "partial": 1, "fail": 1, "unknown": 1, "not_applicable": 0}
      }
    }
  },
  "recommendations": [
    {
      "id": "rec-integration-tests",
      "title": "Strengthen critical-path failure validation",
      "priority": "NOW",
      "phase": "NOW",
      "impact": 90,
      "risk_reduction": 85,
      "effort": "medium",
      "confidence": 90,
      "critical_path": true,
      "unlocks": ["MVP readiness", "production readiness"],
      "definition_of_done": "Critical-path integration tests cover major failure and recovery modes.",
      "why": "The largest evidence gap is failure behavior on the critical path.",
      "leverage_score": 31.17
    },
    {
      "id": "rec-customer-discovery",
      "title": "Validate the first customer workflow",
      "priority": "NEXT",
      "phase": "NOW",
      "impact": 75,
      "risk_reduction": 60,
      "effort": "small",
      "confidence": 70,
      "critical_path": false,
      "unlocks": ["commercial readiness"],
      "definition_of_done": "Several relevant users validate the workflow problem and buying path.",
      "why": "Commercial claims are currently unsupported.",
      "leverage_score": 32.67
    }
  ],
  "action_plan": {
    "top_actions": ["rec-customer-discovery", "rec-integration-tests"],
    "highest_leverage_action": "rec-customer-discovery"
  },
  "limitations": ["This is synthetic example data and does not represent a real project audit."],
  "history": {
    "trajectory": {
      "generated_at": "2026-08-13T09:03:32+00:00",
      "snapshot_count": 3,
      "score_trends": {
        "estimated_completion": {
          "points": 3,
          "series": [
            {"timestamp": "2026-06-13T08:30:00+00:00", "value": 56},
            {"timestamp": "2026-07-13T08:30:00+00:00", "value": 62},
            {"timestamp": "2026-08-13T08:30:00+00:00", "value": 68}
          ],
          "first_value": 56,
          "latest_value": 68,
          "latest_delta": 6,